id,text,date,source,clean,token_count
news_429,Wegovy: Medicare Coverage Expands to Millions With Heart Disease - Healthline. Wegovy: Medicare Coverage Expands to Millions With Heart Disease Healthline,2024-03-26,news,wegovy medicare coverage expands million heart disease healthline wegovy medicare coverage expands million heart disease healthline,16
news_430,Medicare to cover Novo’s obesity drug for some patients - BioPharma Dive. Medicare to cover Novo’s obesity drug for some patients BioPharma Dive,2024-03-22,news,medicare cover novos obesity drug patient biopharma dive medicare cover novos obesity drug patient biopharma dive,16
news_431,Weight loss drugs are driving up premiums at the Massachusetts Health Connector - CBS News. Weight loss drugs are driving up premiums at the Massachusetts Health Connector CBS News,2024-09-13,news,weight loss drug driving premium massachusetts health connector cbs news weight loss drug driving premium massachusetts health connector cbs news,20
news_432,Thinking of buying Wegovy online? Here’s what to know about compounding pharmacies - NPR. Thinking of buying Wegovy online? Here’s what to know about compounding pharmacies NPR,2024-06-07,news,thinking buying wegovy online here know compounding pharmacy npr thinking buying wegovy online here know compounding pharmacy npr,18
news_433,Cost isn’t the only reason Medicare doesn’t cover Wegovy - statnews.com. Cost isn’t the only reason Medicare doesn’t cover Wegovy statnews.com,2024-01-08,news,cost isnt reason medicare doesnt cover wegovy statnewscom cost isnt reason medicare doesnt cover wegovy statnewscom,16
news_434,"WSJ: Elevance Health, Aetna widen coverage for Wegovy following CMS guidance - Fierce Healthcare. WSJ: Elevance Health, Aetna widen coverage for Wegovy following CMS guidance Fierce Healthcare",2024-03-28,news,wsj elevance health aetna widen coverage wegovy following cm guidance fierce healthcare wsj elevance health aetna widen coverage wegovy following cm guidance fierce healthcare,24
news_435,NC coverage of obesity drugs ends April 1. Here are alternatives. - Raleigh News & Observer. NC coverage of obesity drugs ends April 1. Here are alternatives. Raleigh News & Observer,2024-03-25,news,coverage obesity drug end april alternative raleigh news observer coverage obesity drug end april alternative raleigh news observer,18
news_436,"Drugs like Wegovy, Ozempic would be covered by Medicare, Medicaid under Biden proposal - CBS News. Drugs like Wegovy, Ozempic would be covered by Medicare, Medicaid under Biden proposal CBS News",2024-11-27,news,drug wegovy ozempic covered medicare medicaid biden proposal cbs news drug wegovy ozempic covered medicare medicaid biden proposal cbs news,20
news_437,Medicare Advantage insurers mull Wegovy coverage ‘trade-offs’ - Modern Healthcare News. Medicare Advantage insurers mull Wegovy coverage ‘trade-offs’ Modern Healthcare News,2024-04-26,news,medicare advantage insurer mull wegovy coverage tradeoff modern healthcare news medicare advantage insurer mull wegovy coverage tradeoff modern healthcare news,20
news_438,"Ozempic, Wegovy covered by Medicare and Medicaid under Biden admin proposal for anti-obesity GLP-1 drugs - Fox News. Ozempic, Wegovy covered by Medicare and Medicaid under Biden admin proposal for anti-obesity GLP-1 drugs Fox News",2024-11-26,news,ozempic wegovy covered medicare medicaid biden admin proposal antiobesity glp drug fox news ozempic wegovy covered medicare medicaid biden admin proposal antiobesity glp drug fox news,26
news_439,North Carolina state workers' insurance will no longer cover popular weight loss drugs - wfmynews2.com. North Carolina state workers' insurance will no longer cover popular weight loss drugs wfmynews2.com,2024-01-29,news,north carolina state worker insurance longer cover popular weight loss drug wfmynewscom north carolina state worker insurance longer cover popular weight loss drug wfmynewscom,24
news_440,Infographic: Nine States Cover Wegovy Through Medicaid - HealthLeaders Media. Infographic: Nine States Cover Wegovy Through Medicaid HealthLeaders Media,2024-03-26,news,infographic nine state cover wegovy medicaid healthleaders medium infographic nine state cover wegovy medicaid healthleaders medium,16
news_441,"Ozempic is driving up the cost of your health care, whether you can get your hands on it or not - CNBC. Ozempic is driving up the cost of your health care, whether you can get your hands on it or not CNBC",2024-10-11,news,ozempic driving cost health care whether hand cnbc ozempic driving cost health care whether hand cnbc,16
news_442,"North Carolina State Health Plan ends coverage for popular weight-loss drugs, like Wegovy - ABC11 Raleigh-Durham. North Carolina State Health Plan ends coverage for popular weight-loss drugs, like Wegovy ABC11 Raleigh-Durham",2024-04-01,news,north carolina state health plan end coverage popular weightloss drug wegovy abc raleighdurham north carolina state health plan end coverage popular weightloss drug wegovy abc raleighdurham,26
news_443,Demand for weight loss drugs like Ozempic and Wegovy fueling employer health care costs - Fortune. Demand for weight loss drugs like Ozempic and Wegovy fueling employer health care costs Fortune,2024-11-21,news,demand weight loss drug ozempic wegovy fueling employer health care cost fortune demand weight loss drug ozempic wegovy fueling employer health care cost fortune,24
news_444,"Should Wegovy, the $400-a-month obesity medication, be covered by the provinces? - CBC. Should Wegovy, the $400-a-month obesity medication, be covered by the provinces? CBC",2024-06-03,news,wegovy amonth obesity medication covered province cbc wegovy amonth obesity medication covered province cbc,14
news_445,Healthy Returns: More than 50 million privately insured adults could be eligible for GLP-1 drugs - CNBC. Healthy Returns: More than 50 million privately insured adults could be eligible for GLP-1 drugs CNBC,2024-09-10,news,healthy return million privately insured adult could eligible glp drug cnbc healthy return million privately insured adult could eligible glp drug cnbc,22
news_446,House committee passes bill that would allow Medicare to cover weight loss drugs - NBC News. House committee passes bill that would allow Medicare to cover weight loss drugs NBC News,2024-06-27,news,house committee pass bill allow medicare cover weight loss drug nbc news house committee pass bill allow medicare cover weight loss drug nbc news,24
news_447,The Ozempic effect: Insurers ease access to bariatric surgery - Modern Healthcare News. The Ozempic effect: Insurers ease access to bariatric surgery Modern Healthcare News,2024-01-04,news,ozempic effect insurer ease access bariatric surgery modern healthcare news ozempic effect insurer ease access bariatric surgery modern healthcare news,20
news_448,Insurance companies adjusting coverage requirements for weight loss drugs - Spectrum News. Insurance companies adjusting coverage requirements for weight loss drugs Spectrum News,2024-10-21,news,insurance company adjusting coverage requirement weight loss drug spectrum news insurance company adjusting coverage requirement weight loss drug spectrum news,20
news_449,Medicare can now cover Wegovy for more senior citizens - CNN. Medicare can now cover Wegovy for more senior citizens CNN,2024-03-21,news,medicare cover wegovy senior citizen cnn medicare cover wegovy senior citizen cnn,12
news_450,"The State That Chose to Cover Obesity Drugs for Its Poor, but Not Its Own Employees (Published 2024) - The New York Times. The State That Chose to Cover Obesity Drugs for Its Poor, but Not Its Own Employees (Published 2024) The New York Times",2024-08-30,news,state chose cover obesity drug poor employee published new york time state chose cover obesity drug poor employee published new york time,22
news_451,"Employers feel the side effects of drugmaker control over Wegovy, Ozempic costs - Politico. Employers feel the side effects of drugmaker control over Wegovy, Ozempic costs Politico",2024-04-18,news,employer feel side effect drugmaker control wegovy ozempic cost politico employer feel side effect drugmaker control wegovy ozempic cost politico,20
news_452,France to patients: Take weight loss drug Wegovy on your own dime - Euronews.com. France to patients: Take weight loss drug Wegovy on your own dime Euronews.com,2024-10-11,news,france patient take weight loss drug wegovy dime euronewscom france patient take weight loss drug wegovy dime euronewscom,18
news_453,"Wegovy costs $1,349 in the US vs. $92 in the UK. Why are weight loss drugs so pricey? - USA Today. Wegovy costs $1,349 in the US vs. $92 in the UK. Why are weight loss drugs so pricey? USA Today",2024-11-26,news,wegovy cost weight loss drug pricey usa today wegovy cost weight loss drug pricey usa today,16
news_454,Weight-loss drugs didn't curb health costs within two years - Reuters. Weight-loss drugs didn't curb health costs within two years Reuters,2024-10-24,news,weightloss drug didnt curb health cost within two year reuters weightloss drug didnt curb health cost within two year reuters,20
news_455,Coverage for these drugs is being dropped for thousands in Michigan. Patients are angry - The Detroit News. Coverage for these drugs is being dropped for thousands in Michigan. Patients are angry The Detroit News,2024-08-08,news,coverage drug dropped thousand michigan patient angry detroit news coverage drug dropped thousand michigan patient angry detroit news,18
news_456,Weight-loss drug coverage for Illinois state workers could cost hundreds of millions of dollars - Chicago Sun-Times. Weight-loss drug coverage for Illinois state workers could cost hundreds of millions of dollars Chicago Sun-Times,2024-04-30,news,weightloss drug coverage illinois state worker could cost hundred million dollar chicago suntimes weightloss drug coverage illinois state worker could cost hundred million dollar chicago suntimes,26
news_457,Novo Nordisk upset as Dutch agency advises against insurance cover for Wegovy - Reuters. Novo Nordisk upset as Dutch agency advises against insurance cover for Wegovy Reuters,2024-07-17,news,novo nordisk upset dutch agency advises insurance cover wegovy reuters novo nordisk upset dutch agency advises insurance cover wegovy reuters,20
news_458,"The Postal Service Health Benefits program, prescription coverage and Open Season 2025 - Government Executive. The Postal Service Health Benefits program, prescription coverage and Open Season 2025 Government Executive",2024-02-21,news,postal service health benefit program prescription coverage open season government executive postal service health benefit program prescription coverage open season government executive,22
news_459,"You could pay for Wegovy with Medicare, but there’s a catch - Fortune. You could pay for Wegovy with Medicare, but there’s a catch Fortune",2024-03-22,news,could pay wegovy medicare there catch fortune could pay wegovy medicare there catch fortune,14
news_460,"In States That Won’t Pay for Obesity Drugs, ‘They May as Well Have Never Been Created’ (Published 2024) - The New York Times. In States That Won’t Pay for Obesity Drugs, ‘They May as Well Have Never Been Created’ (Published 2024) The New York Times",2024-06-25,news,state wont pay obesity drug may well never created published new york time state wont pay obesity drug may well never created published new york time,26
news_461,Does Medicare Cover Wegovy? - Verywell Health. Does Medicare Cover Wegovy? Verywell Health,2024-05-10,news,medicare cover wegovy verywell health medicare cover wegovy verywell health,10
news_462,"Who gets Ozempic? People with private insurance and generous health plans, study shows - USA Today. Who gets Ozempic? People with private insurance and generous health plans, study shows USA Today",2024-08-07,news,get ozempic people private insurance generous health plan study show usa today get ozempic people private insurance generous health plan study show usa today,24
news_463,"Biden administration proposes Medicare, Medicaid coverage of pricey weight loss drugs - BioPharma Dive. Biden administration proposes Medicare, Medicaid coverage of pricey weight loss drugs BioPharma Dive",2024-11-26,news,biden administration proposes medicare medicaid coverage pricey weight loss drug biopharma dive biden administration proposes medicare medicaid coverage pricey weight loss drug biopharma dive,24
news_464,"Wegovy gains Medicare, Medicaid coverage for heart benefits - Yahoo Finance. Wegovy gains Medicare, Medicaid coverage for heart benefits Yahoo Finance",2024-03-22,news,wegovy gain medicare medicaid coverage heart benefit yahoo finance wegovy gain medicare medicaid coverage heart benefit yahoo finance,18
news_465,High Price of Popular Diabetes Drugs Deprives Low-Income People of Effective Treatment - KFF Health News. High Price of Popular Diabetes Drugs Deprives Low-Income People of Effective Treatment KFF Health News,2024-05-21,news,high price popular diabetes drug deprives lowincome people effective treatment kff health news high price popular diabetes drug deprives lowincome people effective treatment kff health news,26
news_466,Medicare Part D to cover cost of Wegovy when used to reduce risks of heart conditions - Medical Economics. Medicare Part D to cover cost of Wegovy when used to reduce risks of heart conditions Medical Economics,2024-03-22,news,medicare part cover cost wegovy used reduce risk heart condition medical economics medicare part cover cost wegovy used reduce risk heart condition medical economics,24
news_467,Medicare to Cover Wegovy for Certain Indications - Pharmaceutical Executive. Medicare to Cover Wegovy for Certain Indications Pharmaceutical Executive,2024-03-22,news,medicare cover wegovy certain indication pharmaceutical executive medicare cover wegovy certain indication pharmaceutical executive,14
news_468,5 Zepbound Alternatives for Weight Loss - GoodRx. 5 Zepbound Alternatives for Weight Loss GoodRx,2024-07-24,news,zepbound alternative weight loss goodrx zepbound alternative weight loss goodrx,10
news_469,"Wegovy and Ozempic Cost So Much, U.S. Lawmakers Are Intervening - Being Patient. Wegovy and Ozempic Cost So Much, U.S. Lawmakers Are Intervening Being Patient",2024-06-10,news,wegovy ozempic cost much lawmaker intervening patient wegovy ozempic cost much lawmaker intervening patient,14
news_470,Focus: Doctors struggle to get Wegovy for older Americans with heart disease - Reuters. Focus: Doctors struggle to get Wegovy for older Americans with heart disease Reuters,2024-08-15,news,focus doctor struggle wegovy older american heart disease reuters focus doctor struggle wegovy older american heart disease reuters,18
news_471,New York City Utterly Screwed Up Insurance for Employees Taking GLP-1 Weight Loss Drugs - Futurism. New York City Utterly Screwed Up Insurance for Employees Taking GLP-1 Weight Loss Drugs Futurism,2024-10-25,news,new york city utterly screwed insurance employee taking glp weight loss drug futurism new york city utterly screwed insurance employee taking glp weight loss drug futurism,26
news_472,Why Are Drug Prices So High in the US? - diaTribe. Why Are Drug Prices So High in the US? diaTribe,2024-10-01,news,drug price high diatribe drug price high diatribe,8
news_473,North Carolina drops coverage for Wegovy and Ozempic - Fortune. North Carolina drops coverage for Wegovy and Ozempic Fortune,2024-01-27,news,north carolina drop coverage wegovy ozempic fortune north carolina drop coverage wegovy ozempic fortune,14
news_474,Insurance Will Now Cover Popular Weight Loss Drugs for Some Patients - The Healthy. Insurance Will Now Cover Popular Weight Loss Drugs for Some Patients The Healthy,2024-04-03,news,insurance cover popular weight loss drug patient healthy insurance cover popular weight loss drug patient healthy,16
news_475,"Insurers to Cover Novo’s Wegovy for Some Medicare Heart Patients (CVS, AET) - Bloomberg.com. Insurers to Cover Novo’s Wegovy for Some Medicare Heart Patients (CVS, AET) Bloomberg.com",2024-03-28,news,insurer cover novos wegovy medicare heart patient cv aet bloombergcom insurer cover novos wegovy medicare heart patient cv aet bloombergcom,20
news_476,State health leaders hope lawmakers can widen Medicaid access to pricey drugs like Wegovy - North Carolina Health News. State health leaders hope lawmakers can widen Medicaid access to pricey drugs like Wegovy North Carolina Health News,2024-03-13,news,state health leader hope lawmaker widen medicaid access pricey drug wegovy north carolina health news state health leader hope lawmaker widen medicaid access pricey drug wegovy north carolina health news,30
news_477,"Ozempic, Wegovy move closer to no longer being in shortage, FDA says - ABC News. Ozempic, Wegovy move closer to no longer being in shortage, FDA says ABC News",2024-10-30,news,ozempic wegovy move closer longer shortage fda say abc news ozempic wegovy move closer longer shortage fda say abc news,20
news_478,"Wisconsin patients are still suffering effects of Ozempic shortage, pharmacists say - WPR. Wisconsin patients are still suffering effects of Ozempic shortage, pharmacists say WPR",2024-07-24,news,wisconsin patient still suffering effect ozempic shortage pharmacist say wpr wisconsin patient still suffering effect ozempic shortage pharmacist say wpr,20
news_479,"Novo Nordisk's Ozempic and Wegovy now available in the U.S. after shortages, FDA says - CNBC. Novo Nordisk's Ozempic and Wegovy now available in the U.S. after shortages, FDA says CNBC",2024-10-30,news,novo nordisks ozempic wegovy available shortage fda say cnbc novo nordisks ozempic wegovy available shortage fda say cnbc,18
news_480,Ozempic and Wegovy considered ‘available’ after more than 2 years in shortage - The Hill. Ozempic and Wegovy considered ‘available’ after more than 2 years in shortage The Hill,2024-10-30,news,ozempic wegovy considered available year shortage hill ozempic wegovy considered available year shortage hill,14
news_481,Novo Nordisk's Ozempic shortage expected to continue into Q4 - Reuters. Novo Nordisk's Ozempic shortage expected to continue into Q4 Reuters,2024-09-02,news,novo nordisks ozempic shortage expected continue reuters novo nordisks ozempic shortage expected continue reuters,14
news_482,"Novo takes big step toward ending Ozempic, Wegovy shortages - BioPharma Dive. Novo takes big step toward ending Ozempic, Wegovy shortages BioPharma Dive",2024-10-30,news,novo take big step toward ending ozempic wegovy shortage biopharma dive novo take big step toward ending ozempic wegovy shortage biopharma dive,22
news_483,"Drug Shortages: Ozempic, Mounjaro, and More - diaTribe. Drug Shortages: Ozempic, Mounjaro, and More diaTribe",2024-05-02,news,drug shortage ozempic mounjaro diatribe drug shortage ozempic mounjaro diatribe,10
news_484,"Novo Nordisk’s Ozempic and Wegovy, long in shortage, are now listed as available by FDA - statnews.com. Novo Nordisk’s Ozempic and Wegovy, long in shortage, are now listed as available by FDA statnews.com",2024-10-30,news,novo nordisks ozempic wegovy long shortage listed available fda statnewscom novo nordisks ozempic wegovy long shortage listed available fda statnewscom,20
news_485,The end of a shortage of popular weight-loss drugs may mean many people lose access to them - CNN. The end of a shortage of popular weight-loss drugs may mean many people lose access to them CNN,2024-10-09,news,end shortage popular weightloss drug may mean many people lose access cnn end shortage popular weightloss drug may mean many people lose access cnn,24
news_486,Injectable Semaglutide Shortage Forces Physicians to Pivot - TCTMD.com. Injectable Semaglutide Shortage Forces Physicians to Pivot TCTMD.com,2024-02-05,news,injectable semaglutide shortage force physician pivot tctmdcom injectable semaglutide shortage force physician pivot tctmdcom,14
news_487,The Ozempic Shortage Is Over - The Atlantic. The Ozempic Shortage Is Over The Atlantic,2024-08-16,news,ozempic shortage atlantic ozempic shortage atlantic,6
news_488,"UPDATED: FDA lists all doses of Novo's Wegovy as available, signaling potential end to semaglutide supply rout in US - Fierce Pharma. UPDATED: FDA lists all doses of Novo's Wegovy as available, signaling potential end to semaglutide supply rout in US Fierce Pharma",2024-10-31,news,updated fda list dos novos wegovy available signaling potential end semaglutide supply rout fierce pharma updated fda list dos novos wegovy available signaling potential end semaglutide supply rout fierce pharma,30
news_489,Weight-loss drug shortages have patients stressed over missing doses - Axios. Weight-loss drug shortages have patients stressed over missing doses Axios,2024-05-16,news,weightloss drug shortage patient stressed missing dos axios weightloss drug shortage patient stressed missing dos axios,16
news_490,The Ozempic shortage is getting worse - qz.com. The Ozempic shortage is getting worse qz.com,2024-09-03,news,ozempic shortage getting worse qzcom ozempic shortage getting worse qzcom,10
news_491,Novo’s Ozempic to Remain in Shortage Into Q4 as Supply Woes Continue - BioSpace. Novo’s Ozempic to Remain in Shortage Into Q4 as Supply Woes Continue BioSpace,2024-09-03,news,novos ozempic remain shortage supply woe continue biospace novos ozempic remain shortage supply woe continue biospace,16
news_492,Ozempic Shortages Raise Questions About Priority Access For Diabetics - Forbes. Ozempic Shortages Raise Questions About Priority Access For Diabetics Forbes,2024-07-19,news,ozempic shortage raise question priority access diabetic forbes ozempic shortage raise question priority access diabetic forbes,16
news_493,"Drugmakers say obesity medicine shortages are easing, but patients struggle to fill prescriptions - NPR. Drugmakers say obesity medicine shortages are easing, but patients struggle to fill prescriptions NPR",2024-09-06,news,drugmakers say obesity medicine shortage easing patient struggle fill prescription npr drugmakers say obesity medicine shortage easing patient struggle fill prescription npr,22
news_494,Ozempic shortages in EU will not affect all member states - Novo Nordisk - Reuters. Ozempic shortages in EU will not affect all member states - Novo Nordisk Reuters,2024-09-04,news,ozempic shortage affect member state novo nordisk reuters ozempic shortage affect member state novo nordisk reuters,16
news_495,Weight loss medication shortage creates market for bogus drugs - Fox Business. Weight loss medication shortage creates market for bogus drugs Fox Business,2024-02-01,news,weight loss medication shortage creates market bogus drug fox business weight loss medication shortage creates market bogus drug fox business,20
news_496,There's an Ozempic Shortage—People Actually Affected Weigh In - Vogue. There's an Ozempic Shortage—People Actually Affected Weigh In Vogue,2024-02-02,news,there ozempic shortagepeople actually affected weigh vogue there ozempic shortagepeople actually affected weigh vogue,14
news_497,"FDA Says All Doses of Novo’s Ozempic, Wegovy Now Available - BioSpace. FDA Says All Doses of Novo’s Ozempic, Wegovy Now Available BioSpace",2024-10-31,news,fda say dos novos ozempic wegovy available biospace fda say dos novos ozempic wegovy available biospace,16
news_498,Novo Nordisk's Ozempic shortage expected to continue into Q4 - Yahoo Finance. Novo Nordisk's Ozempic shortage expected to continue into Q4 Yahoo Finance,2024-09-02,news,novo nordisks ozempic shortage expected continue yahoo finance novo nordisks ozempic shortage expected continue yahoo finance,16
news_499,"GLP-1 Drug Shortage Is Over, but Cost and Access Issues May Remain - Verywell Health. GLP-1 Drug Shortage Is Over, but Cost and Access Issues May Remain Verywell Health",2024-11-08,news,glp drug shortage cost access issue may remain verywell health glp drug shortage cost access issue may remain verywell health,20
news_500,"Novo Nearly Catches Up to Lilly, Clears Ozempic and Wegovy from FDA Drug Shortage List - BioSpace. Novo Nearly Catches Up to Lilly, Clears Ozempic and Wegovy from FDA Drug Shortage List BioSpace",2024-08-07,news,novo nearly catch lilly clear ozempic wegovy fda drug shortage list biospace novo nearly catch lilly clear ozempic wegovy fda drug shortage list biospace,24
news_501,"In Europe, shortages of Novo Nordisk's Ozempic to persist into Q4: letter - Fierce Pharma. In Europe, shortages of Novo Nordisk's Ozempic to persist into Q4: letter Fierce Pharma",2024-09-03,news,europe shortage novo nordisks ozempic persist letter fierce pharma europe shortage novo nordisks ozempic persist letter fierce pharma,18
news_502,"Novo Nordisk announces $6B investment in Ozempic, Wegovy amid shortages - ABC News. Novo Nordisk announces $6B investment in Ozempic, Wegovy amid shortages ABC News",2024-05-02,news,novo nordisk announces investment ozempic wegovy amid shortage abc news novo nordisk announces investment ozempic wegovy amid shortage abc news,20
news_503,"Who’s taking Ozempic? New data reveals ‘significant’ shift, prompts shortage fears - New York Post. Who’s taking Ozempic? New data reveals ‘significant’ shift, prompts shortage fears New York Post",2024-07-22,news,who taking ozempic new data reveals significant shift prompt shortage fear new york post who taking ozempic new data reveals significant shift prompt shortage fear new york post,28
news_504,"While brand-name weight loss drugs are in short supply, a market for alternatives thrives - CBS News. While brand-name weight loss drugs are in short supply, a market for alternatives thrives CBS News",2024-09-21,news,brandname weight loss drug short supply market alternative thrives cbs news brandname weight loss drug short supply market alternative thrives cbs news,22
