id,text,date,source,clean,token_count
news_280,EU actions to tackle shortages of GLP-1 receptor agonists - European Medicines Agency. EU actions to tackle shortages of GLP-1 receptor agonists European Medicines Agency,2024-06-26,news,action tackle shortage glp receptor agonist european medicine agency action tackle shortage glp receptor agonist european medicine agency,18
news_281,Doctors' Tips for Accessing Costly GLP-1 Therapies - Medscape. Doctors' Tips for Accessing Costly GLP-1 Therapies Medscape,2024-06-03,news,doctor tip accessing costly glp therapy medscape doctor tip accessing costly glp therapy medscape,14
news_282,Q&A: Can weight loss drugs help in addiction treatment? - Penn State Health News. Q&A: Can weight loss drugs help in addiction treatment? Penn State Health News,2024-04-11,news,weight loss drug help addiction treatment penn state health news weight loss drug help addiction treatment penn state health news,20
news_283,Insurer strategies to control costs associated with weight loss drugs - healthsystemtracker.org. Insurer strategies to control costs associated with weight loss drugs healthsystemtracker.org,2024-06-12,news,insurer strategy control cost associated weight loss drug healthsystemtrackerorg insurer strategy control cost associated weight loss drug healthsystemtrackerorg,18
news_284,How to Use Weight-Loss Medication Safely - Hackensack Meridian Health. How to Use Weight-Loss Medication Safely Hackensack Meridian Health,2024-01-22,news,use weightloss medication safely hackensack meridian health use weightloss medication safely hackensack meridian health,14
news_285,Research Suggests Enhancing Diabetes and Weight Loss Drug may be a Game Changer for Liver Disease - VCU Health. Research Suggests Enhancing Diabetes and Weight Loss Drug may be a Game Changer for Liver Disease VCU Health,2024-06-07,news,research suggests enhancing diabetes weight loss drug may game changer liver disease vcu health research suggests enhancing diabetes weight loss drug may game changer liver disease vcu health,28
news_286,What to Know About Weight-Loss Drugs and Joint Pain - HSS | Hospital for Special Surgery. What to Know About Weight-Loss Drugs and Joint Pain HSS | Hospital for Special Surgery,2024-08-19,news,know weightloss drug joint pain hs hospital special surgery know weightloss drug joint pain hs hospital special surgery,18
news_287,Medicare Coverage of Weight Loss Drugs Could Save the U.S. Billions of Dollars - USC Schaeffer. Medicare Coverage of Weight Loss Drugs Could Save the U.S. Billions of Dollars USC Schaeffer,2024-04-03,news,medicare coverage weight loss drug could save billion dollar usc schaeffer medicare coverage weight loss drug could save billion dollar usc schaeffer,22
news_288,Prescription for Success - University of Kansas Medical Center. Prescription for Success University of Kansas Medical Center,2024-07-12,news,prescription success university kansa medical center prescription success university kansa medical center,12
news_289,Rise in obesity drug use linked with decrease in weight-loss surgery - Harvard T.H. Chan School of Public Health. Rise in obesity drug use linked with decrease in weight-loss surgery Harvard T.H. Chan School of Public Health,2024-11-01,news,rise obesity drug use linked decrease weightloss surgery harvard chan school public health rise obesity drug use linked decrease weightloss surgery harvard chan school public health,26
news_290,Why GLP-1 is not the only answer for treating obesity - The World Economic Forum. Why GLP-1 is not the only answer for treating obesity The World Economic Forum,2024-01-10,news,glp answer treating obesity world economic forum glp answer treating obesity world economic forum,14
news_291,Insurer Strategies to Control Costs Associated with Weight Loss Drugs - KFF. Insurer Strategies to Control Costs Associated with Weight Loss Drugs KFF,2024-06-12,news,insurer strategy control cost associated weight loss drug kff insurer strategy control cost associated weight loss drug kff,18
news_292,How weight loss drugs are showing promise beyond shedding pounds - The Hill. How weight loss drugs are showing promise beyond shedding pounds The Hill,2024-08-07,news,weight loss drug showing promise beyond shedding pound hill weight loss drug showing promise beyond shedding pound hill,18
news_293,Decoding the Buzz Around Weight-loss Medications: Unpacking the Revolution of GLP-1 Medications - IQVIA. Decoding the Buzz Around Weight-loss Medications: Unpacking the Revolution of GLP-1 Medications IQVIA,2024-03-28,news,decoding buzz around weightloss medication unpacking revolution glp medication iqvia decoding buzz around weightloss medication unpacking revolution glp medication iqvia,20
news_294,"Rising Costs Lead Insurers to Drop Weight Loss Drug Coverage, Further Increasing Patient Burden - The American Journal of Managed Care® (AJMC®). Rising Costs Lead Insurers to Drop Weight Loss Drug Coverage, Further Increasing Patient Burden The American Journal of Managed Care® (AJMC®)",2024-08-06,news,rising cost lead insurer drop weight loss drug coverage increasing patient burden american journal managed care ajmc rising cost lead insurer drop weight loss drug coverage increasing patient burden american journal managed care ajmc,34
news_295,Insurance denials for popular new weight loss medications leave patients with risky choices - CNN. Insurance denials for popular new weight loss medications leave patients with risky choices CNN,2024-01-08,news,insurance denial popular new weight loss medication leave patient risky choice cnn insurance denial popular new weight loss medication leave patient risky choice cnn,24
news_296,Should heart patients consider taking weight loss medications? - michiganmedicine.org. Should heart patients consider taking weight loss medications? michiganmedicine.org,2024-02-07,news,heart patient consider taking weight loss medication michiganmedicineorg heart patient consider taking weight loss medication michiganmedicineorg,16
news_297,Key Lessons for Ethical and Affordable Access to GLP-1 Drugs Like Ozempic and Wegovy - Penn LDI. Key Lessons for Ethical and Affordable Access to GLP-1 Drugs Like Ozempic and Wegovy Penn LDI,2024-10-17,news,key lesson ethical affordable access glp drug ozempic wegovy penn ldi key lesson ethical affordable access glp drug ozempic wegovy penn ldi,22
news_298,Patients taking weight loss medications require proper nutrition - UCLA Health. Patients taking weight loss medications require proper nutrition UCLA Health,2024-07-23,news,patient taking weight loss medication require proper nutrition ucla health patient taking weight loss medication require proper nutrition ucla health,20
news_299,FDA Advised to Update Labels on GLP-1 Weight-Loss Drugs - The American Journal of Managed Care® (AJMC®). FDA Advised to Update Labels on GLP-1 Weight-Loss Drugs The American Journal of Managed Care® (AJMC®),2024-11-25,news,fda advised update label glp weightloss drug american journal managed care ajmc fda advised update label glp weightloss drug american journal managed care ajmc,24
news_300,"Many people using GLP-1s for weight loss stop treatment too soon, research shows, and results are not one-size-fits-all - CNN. Many people using GLP-1s for weight loss stop treatment too soon, research shows, and results are not one-size-fits-all CNN",2024-05-21,news,many people using glps weight loss stop treatment soon research show result onesizefitsall cnn many people using glps weight loss stop treatment soon research show result onesizefitsall cnn,28
news_301,Estimating the lives that could be saved by expanded access to weight-loss drugs - PNAS. Estimating the lives that could be saved by expanded access to weight-loss drugs PNAS,2024-10-20,news,estimating life could saved expanded access weightloss drug pnas estimating life could saved expanded access weightloss drug pnas,18
news_302,Your employer may start covering weight-loss drugs soon - CNN. Your employer may start covering weight-loss drugs soon CNN,2024-10-09,news,employer may start covering weightloss drug soon cnn employer may start covering weightloss drug soon cnn,16
news_303,"How to find reliable health information, weight loss drug research and GLP-1 side effects - American Medical Association. How to find reliable health information, weight loss drug research and GLP-1 side effects American Medical Association",2024-05-24,news,find reliable health information weight loss drug research glp side effect american medical association find reliable health information weight loss drug research glp side effect american medical association,28
news_304,"Weight loss drugs alone are not enough for individuals to achieve health goals, researchers say - University College London. Weight loss drugs alone are not enough for individuals to achieve health goals, researchers say University College London",2024-08-13,news,weight loss drug alone enough individual achieve health goal researcher say university college london weight loss drug alone enough individual achieve health goal researcher say university college london,28
news_305,Weight loss injectables - Swiss Re. Weight loss injectables Swiss Re,2024-10-22,news,weight loss injectables swiss weight loss injectables swiss,8
news_306,Expanding access to GLP-1 weight-loss drugs could save thousands of lives - News-Medical. Expanding access to GLP-1 weight-loss drugs could save thousands of lives News-Medical,2024-10-16,news,expanding access glp weightloss drug could save thousand life newsmedical expanding access glp weightloss drug could save thousand life newsmedical,20
news_307,Older weight loss drugs are in demand. But are they safe or effective? And should you take them? - Northeastern Global News. Older weight loss drugs are in demand. But are they safe or effective? And should you take them? Northeastern Global News,2024-07-08,news,older weight loss drug demand safe effective take northeastern global news older weight loss drug demand safe effective take northeastern global news,22
news_308,Bariatric Surgery Is More Cost Effective Than Newer Weight Loss Drugs Alone - The American College of Surgeons. Bariatric Surgery Is More Cost Effective Than Newer Weight Loss Drugs Alone The American College of Surgeons,2024-10-18,news,bariatric surgery cost effective newer weight loss drug alone american college surgeon bariatric surgery cost effective newer weight loss drug alone american college surgeon,24
news_309,Monitoring Patients Who Take GLP-1 RAs for Weight Loss – What Prescribers Should Know - ECRI. Monitoring Patients Who Take GLP-1 RAs for Weight Loss – What Prescribers Should Know ECRI,2024-03-05,news,monitoring patient take glp ra weight loss prescribers know ecri monitoring patient take glp ra weight loss prescribers know ecri,20
news_310,West Virginia residents struggle to afford GLP-1 weight loss drugs after state ends subsidy program - CBS News. West Virginia residents struggle to afford GLP-1 weight loss drugs after state ends subsidy program CBS News,2024-11-25,news,west virginia resident struggle afford glp weight loss drug state end subsidy program cbs news west virginia resident struggle afford glp weight loss drug state end subsidy program cbs news,30
news_311,Weight loss drugs without the nausea? Mouse study suggests it may be possible - Science | AAAS. Weight loss drugs without the nausea? Mouse study suggests it may be possible Science | AAAS,2024-07-10,news,weight loss drug without nausea mouse study suggests may possible science aaa weight loss drug without nausea mouse study suggests may possible science aaa,24
news_312,"Popular weight-loss and diabetes medications linked to lower risk of some cancers, study finds - CNN. Popular weight-loss and diabetes medications linked to lower risk of some cancers, study finds CNN",2024-07-05,news,popular weightloss diabetes medication linked lower risk cancer study find cnn popular weightloss diabetes medication linked lower risk cancer study find cnn,22
news_313,How digital health companies are capitalizing on the GLP-1 boom - CNBC. How digital health companies are capitalizing on the GLP-1 boom CNBC,2024-05-25,news,digital health company capitalizing glp boom cnbc digital health company capitalizing glp boom cnbc,14
news_314,Can New Drugs Help Millions of Americans with Obesity? - Harvard Magazine. Can New Drugs Help Millions of Americans with Obesity? Harvard Magazine,2024-09-30,news,new drug help million american obesity harvard magazine new drug help million american obesity harvard magazine,16
news_315,The Multi-Sector Impacts of GLP-1RA Drugs - Teneo. The Multi-Sector Impacts of GLP-1RA Drugs Teneo,2024-03-07,news,multisector impact glpra drug teneo multisector impact glpra drug teneo,10
news_316,Medicare Spending on Ozempic and Other GLP-1s Is Skyrocketing - KFF. Medicare Spending on Ozempic and Other GLP-1s Is Skyrocketing KFF,2024-03-22,news,medicare spending ozempic glps skyrocketing kff medicare spending ozempic glps skyrocketing kff,12
news_317,About 13% of U.S. Adults Have Tried a GLP-1 Drug Like Ozempic - Healthline. About 13% of U.S. Adults Have Tried a GLP-1 Drug Like Ozempic Healthline,2024-05-13,news,adult tried glp drug ozempic healthline adult tried glp drug ozempic healthline,12
news_318,Weight management in the era of GLP-1s - Mercer. Weight management in the era of GLP-1s Mercer,2024-03-28,news,weight management era glps mercer weight management era glps mercer,10
news_319,Ilisa was vomiting blood after injecting replica Ozempic. The pharmacy kept ringing to sell her more - Australian Broadcasting Corporation. Ilisa was vomiting blood after injecting replica Ozempic. The pharmacy kept ringing to sell her more Australian Broadcasting Corporation,2024-05-13,news,ilisa vomiting blood injecting replica ozempic pharmacy kept ringing sell australian broadcasting corporation ilisa vomiting blood injecting replica ozempic pharmacy kept ringing sell australian broadcasting corporation,26
news_320,5 unexpected side effects of Ozempic use - MDLinx. 5 unexpected side effects of Ozempic use MDLinx,2024-11-20,news,unexpected side effect ozempic use mdlinx unexpected side effect ozempic use mdlinx,12
news_321,Ozempic's biggest side effect: Turning Denmark into a 'pharmastate'? : Planet Money - NPR. Ozempic's biggest side effect: Turning Denmark into a 'pharmastate'? : Planet Money NPR,2024-07-30,news,ozempics biggest side effect turning denmark pharmastate planet money npr ozempics biggest side effect turning denmark pharmastate planet money npr,20
news_322,Patients Are Suing Over Alleged Side Effects of Weight-Loss Drugs - Time Magazine. Patients Are Suing Over Alleged Side Effects of Weight-Loss Drugs Time Magazine,2024-11-04,news,patient suing alleged side effect weightloss drug time magazine patient suing alleged side effect weightloss drug time magazine,18
news_323,Ozempic Face — and Now Ozempic Breast and Butt? What's Really Going on with These Side Effects? - People.com. Ozempic Face — and Now Ozempic Breast and Butt? What's Really Going on with These Side Effects? People.com,2024-05-08,news,ozempic face ozempic breast butt whats really going side effect peoplecom ozempic face ozempic breast butt whats really going side effect peoplecom,22
news_324,Old Drugs Are Linked to New Side Effects More Often Than You Think - Bloomberg.com. Old Drugs Are Linked to New Side Effects More Often Than You Think Bloomberg.com,2024-07-08,news,old drug linked new side effect often think bloombergcom old drug linked new side effect often think bloombergcom,18
news_325,Ozempic Butt Isn't The Strangest Side Effect Of The Drug. Here's What Else To Expect. - Women's Health. Ozempic Butt Isn't The Strangest Side Effect Of The Drug. Here's What Else To Expect. Women's Health,2024-10-15,news,ozempic butt isnt strangest side effect drug here else expect womens health ozempic butt isnt strangest side effect drug here else expect womens health,24
news_326,"At 56, Macy Gray Says She Was Hospitalized for Ozempic Side Effects - Prevention. At 56, Macy Gray Says She Was Hospitalized for Ozempic Side Effects Prevention",2024-08-08,news,macy gray say hospitalized ozempic side effect prevention macy gray say hospitalized ozempic side effect prevention,16
news_327,Is Nausea on Ozempic Serious? Learn More About Causes & Risks - Motley Rice. Is Nausea on Ozempic Serious? Learn More About Causes & Risks Motley Rice,2024-02-20,news,nausea ozempic serious learn cause risk motley rice nausea ozempic serious learn cause risk motley rice,16
news_328,"Do Ozempic and Wegovy have hidden side effects? Lawsuit alleges bowel obstruction, stomach paralysis - KTLA. Do Ozempic and Wegovy have hidden side effects? Lawsuit alleges bowel obstruction, stomach paralysis KTLA",2024-09-05,news,ozempic wegovy hidden side effect lawsuit alleges bowel obstruction stomach paralysis ktla ozempic wegovy hidden side effect lawsuit alleges bowel obstruction stomach paralysis ktla,24
news_329,What is 'Ozempic face'? How we refer to weight-loss side effects matters. - USA Today. What is 'Ozempic face'? How we refer to weight-loss side effects matters. USA Today,2024-09-27,news,ozempic face refer weightloss side effect matter usa today ozempic face refer weightloss side effect matter usa today,18
news_330,Side Effects of GLP-1 Drugs: What Doctors Should Know - Medscape. Side Effects of GLP-1 Drugs: What Doctors Should Know Medscape,2024-11-21,news,side effect glp drug doctor know medscape side effect glp drug doctor know medscape,14
news_331,‘Ozempic Personality’: How Weight Loss Drugs Can Affect Your Behavior - Healthline. ‘Ozempic Personality’: How Weight Loss Drugs Can Affect Your Behavior Healthline,2024-04-23,news,ozempic personality weight loss drug affect behavior healthline ozempic personality weight loss drug affect behavior healthline,16
news_332,Ozempic can lead to muscle mass loss: Study - The Hill. Ozempic can lead to muscle mass loss: Study The Hill,2024-11-09,news,ozempic lead muscle mass loss study hill ozempic lead muscle mass loss study hill,14
news_333,'Ozempic tongue' and other oral side effects explained - MDLinx. 'Ozempic tongue' and other oral side effects explained MDLinx,2024-07-23,news,ozempic tongue oral side effect explained mdlinx ozempic tongue oral side effect explained mdlinx,14
news_334,Ozempic Gastroparesis Lawsuit | You May Have Legal Options - Motley Rice. Ozempic Gastroparesis Lawsuit | You May Have Legal Options Motley Rice,2024-02-20,news,ozempic gastroparesis lawsuit may legal option motley rice ozempic gastroparesis lawsuit may legal option motley rice,16
news_335,Warning about side effects of Ozempic and other weight loss drugs - WKRC. Warning about side effects of Ozempic and other weight loss drugs WKRC,2024-08-21,news,warning side effect ozempic weight loss drug wkrc warning side effect ozempic weight loss drug wkrc,16
news_336,Ozempic May Have Another Side Effect: Better Sex - WSJ - The Wall Street Journal. Ozempic May Have Another Side Effect: Better Sex - WSJ The Wall Street Journal,2024-08-10,news,ozempic may another side effect better sex wsj wall street journal ozempic may another side effect better sex wsj wall street journal,22
news_337,"Ozempic: Alternatives, Side Effects, and Benefits | Dr. Michael Greger - Physicians Committee for Responsible Medicine. Ozempic: Alternatives, Side Effects, and Benefits | Dr. Michael Greger Physicians Committee for Responsible Medicine",2024-10-30,news,ozempic alternative side effect benefit michael greger physician committee responsible medicine ozempic alternative side effect benefit michael greger physician committee responsible medicine,22
news_338,Drugs Like Ozempic May Have a Shrinking Effect on The Heart - ScienceAlert. Drugs Like Ozempic May Have a Shrinking Effect on The Heart ScienceAlert,2024-11-22,news,drug ozempic may shrinking effect heart sciencealert drug ozempic may shrinking effect heart sciencealert,14
news_339,Macy Gray Details TMI Side Effect While Taking Ozempic - E! News. Macy Gray Details TMI Side Effect While Taking Ozempic E! News,2024-08-01,news,macy gray detail tmi side effect taking ozempic news macy gray detail tmi side effect taking ozempic news,18
news_340,Can Ozempic Kill You? Here's What Doctors Say - Women's Health. Can Ozempic Kill You? Here's What Doctors Say Women's Health,2024-11-20,news,ozempic kill here doctor say womens health ozempic kill here doctor say womens health,14
news_341,‘Ozempic Breasts’ Side Effect Reported by People Taking Weight Loss Drugs - Healthline. ‘Ozempic Breasts’ Side Effect Reported by People Taking Weight Loss Drugs Healthline,2024-05-08,news,ozempic breast side effect reported people taking weight loss drug healthline ozempic breast side effect reported people taking weight loss drug healthline,22
news_342,Popular weight loss and diabetes drugs linked to increased risk of rare form of blindness - CNN. Popular weight loss and diabetes drugs linked to increased risk of rare form of blindness CNN,2024-07-03,news,popular weight loss diabetes drug linked increased risk rare form blindness cnn popular weight loss diabetes drug linked increased risk rare form blindness cnn,24
news_343,A new weight loss drug could beat Ozempic's side effect problem - qz.com. A new weight loss drug could beat Ozempic's side effect problem qz.com,2024-11-05,news,new weight loss drug could beat ozempics side effect problem qzcom new weight loss drug could beat ozempics side effect problem qzcom,22
news_344,'Ozempic breasts': What are the side effects of weight loss drugs? - Euronews.com. 'Ozempic breasts': What are the side effects of weight loss drugs? Euronews.com,2024-05-19,news,ozempic breast side effect weight loss drug euronewscom ozempic breast side effect weight loss drug euronewscom,16
news_345,Does Ozempic Cause Erectile Dysfunction? Here’s What to Know - GoodRx. Does Ozempic Cause Erectile Dysfunction? Here’s What to Know GoodRx,2024-07-15,news,ozempic cause erectile dysfunction here know goodrx ozempic cause erectile dysfunction here know goodrx,14
news_346,Tracking Ozempic’s Nausea Side Effect to Specific Neurons May Lead to Better Drugs - Scientific American. Tracking Ozempic’s Nausea Side Effect to Specific Neurons May Lead to Better Drugs Scientific American,2024-07-12,news,tracking ozempics nausea side effect specific neuron may lead better drug scientific american tracking ozempics nausea side effect specific neuron may lead better drug scientific american,26
news_347,"She took Ozempic, now she can't eat without vomiting. Lawsuit claims the drug made her ill - Cincinnati Enquirer. She took Ozempic, now she can't eat without vomiting. Lawsuit claims the drug made her ill Cincinnati Enquirer",2024-09-26,news,took ozempic cant eat without vomiting lawsuit claim drug made ill cincinnati enquirer took ozempic cant eat without vomiting lawsuit claim drug made ill cincinnati enquirer,26
news_348,"Ozempic Side Effects May Shrink Heart Muscles, Study Warns - AboutLawsuits.com. Ozempic Side Effects May Shrink Heart Muscles, Study Warns AboutLawsuits.com",2024-11-20,news,ozempic side effect may shrink heart muscle study warns aboutlawsuitscom ozempic side effect may shrink heart muscle study warns aboutlawsuitscom,20
news_349,Ozempic judge’s order raises early hurdles for plaintiffs suing over side effects - Reuters. Ozempic judge’s order raises early hurdles for plaintiffs suing over side effects Reuters,2024-08-28,news,ozempic judge order raise early hurdle plaintiff suing side effect reuters ozempic judge order raise early hurdle plaintiff suing side effect reuters,22
news_350,‘RHOD’ Star Caroline Stanbury Shares ‘Terrible’ Reaction to Ozempic and Alcohol - Prevention. ‘RHOD’ Star Caroline Stanbury Shares ‘Terrible’ Reaction to Ozempic and Alcohol Prevention,2024-08-21,news,rhod star caroline stanbury share terrible reaction ozempic alcohol prevention rhod star caroline stanbury share terrible reaction ozempic alcohol prevention,20
news_351,Louisville patients warn about dangers of weight loss drugs and life-changing side effects - WDRB. Louisville patients warn about dangers of weight loss drugs and life-changing side effects WDRB,2024-06-28,news,louisville patient warn danger weight loss drug lifechanging side effect wdrb louisville patient warn danger weight loss drug lifechanging side effect wdrb,22
news_352,Ozempic Breath: Can Weight Loss Drugs Cause Halitosis? - Healthline. Ozempic Breath: Can Weight Loss Drugs Cause Halitosis? Healthline,2024-05-02,news,ozempic breath weight loss drug cause halitosis healthline ozempic breath weight loss drug cause halitosis healthline,16
news_353,‘Ozempic Personality’: What to Know About Weight Loss and Mood Changes - Prevention. ‘Ozempic Personality’: What to Know About Weight Loss and Mood Changes Prevention,2024-04-25,news,ozempic personality know weight loss mood change prevention ozempic personality know weight loss mood change prevention,16
news_354,"Ozempic or Wegovy can be a godsend, but their non-medical use is alarming | Devi Sridhar - The Guardian. Ozempic or Wegovy can be a godsend, but their non-medical use is alarming | Devi Sridhar The Guardian",2024-07-31,news,ozempic wegovy godsend nonmedical use alarming devi sridhar guardian ozempic wegovy godsend nonmedical use alarming devi sridhar guardian,18
news_355,Ozempic butt: A side effect of this popular diabetes and weight loss drug - Healthshots. Ozempic butt: A side effect of this popular diabetes and weight loss drug Healthshots,2024-11-10,news,ozempic butt side effect popular diabetes weight loss drug healthshots ozempic butt side effect popular diabetes weight loss drug healthshots,20
