id,text,date,source,clean,token_count
news_0,The Rise of Ozempic for Weight Loss Sparks Ethical Concerns - Columbia University Department of Psychiatry. The Rise of Ozempic for Weight Loss Sparks Ethical Concerns Columbia University Department of Psychiatry,2024-10-16,news,rise ozempic weight loss spark ethical concern columbia university department psychiatry rise ozempic weight loss spark ethical concern columbia university department psychiatry,22
news_1,The Medical Minute: What to know about Ozempic and weight loss drugs - Penn State Health News. The Medical Minute: What to know about Ozempic and weight loss drugs Penn State Health News,2024-07-10,news,medical minute know ozempic weight loss drug penn state health news medical minute know ozempic weight loss drug penn state health news,22
news_2,"The pros, cons, and unknowns of popular weight-loss drugs - Johns Hopkins University. The pros, cons, and unknowns of popular weight-loss drugs Johns Hopkins University",2024-01-11,news,pro con unknown popular weightloss drug john hopkins university pro con unknown popular weightloss drug john hopkins university,18
news_3,Weight-loss drugs aren't a magic bullet. Lifestyle changes are key to lasting health - NPR. Weight-loss drugs aren't a magic bullet. Lifestyle changes are key to lasting health NPR,2024-02-12,news,weightloss drug arent magic bullet lifestyle change key lasting health npr weightloss drug arent magic bullet lifestyle change key lasting health npr,22
news_4,The Promise of Weight-Loss Drugs (Published 2024) - The New York Times. The Promise of Weight-Loss Drugs (Published 2024) The New York Times,2024-06-24,news,promise weightloss drug published new york time promise weightloss drug published new york time,14
news_5,Mayo Clinic Minute: Weight-loss medications alone are not a quick fix - Mayo Clinic News Network. Mayo Clinic Minute: Weight-loss medications alone are not a quick fix Mayo Clinic News Network,2024-01-11,news,mayo clinic minute weightloss medication alone quick fix mayo clinic news network mayo clinic minute weightloss medication alone quick fix mayo clinic news network,24
news_6,How Americans View Weight-Loss Drugs and Their Potential Impact on Obesity in the U.S. - Pew Research Center. How Americans View Weight-Loss Drugs and Their Potential Impact on Obesity in the U.S. Pew Research Center,2024-02-26,news,american view weightloss drug potential impact obesity pew research center american view weightloss drug potential impact obesity pew research center,20
news_7,Considering taking a weight-loss drug like Ozempic? Here are some potential risks and benefits - The Conversation. Considering taking a weight-loss drug like Ozempic? Here are some potential risks and benefits The Conversation,2024-04-01,news,considering taking weightloss drug ozempic potential risk benefit conversation considering taking weightloss drug ozempic potential risk benefit conversation,18
news_8,Lost and found: Life after Ozempic and other weight-loss drugs was just the start for these four people - CNN. Lost and found: Life after Ozempic and other weight-loss drugs was just the start for these four people CNN,2024-11-16,news,lost found life ozempic weightloss drug start four people cnn lost found life ozempic weightloss drug start four people cnn,20
news_9,Young people are increasingly using Wegovy and Ozempic - michiganmedicine.org. Young people are increasingly using Wegovy and Ozempic michiganmedicine.org,2024-05-22,news,young people increasingly using wegovy ozempic michiganmedicineorg young people increasingly using wegovy ozempic michiganmedicineorg,14
news_10,Ozempic and Other Weight-Loss Drugs Are Sparking a Risky New War on Obesity - Scientific American. Ozempic and Other Weight-Loss Drugs Are Sparking a Risky New War on Obesity Scientific American,2024-01-24,news,ozempic weightloss drug sparking risky new war obesity scientific american ozempic weightloss drug sparking risky new war obesity scientific american,20
news_11,Weight Loss Drugs: Is Ozempic the Answer? - Kettering Health. Weight Loss Drugs: Is Ozempic the Answer? Kettering Health,2024-07-02,news,weight loss drug ozempic answer kettering health weight loss drug ozempic answer kettering health,14
news_12,"GLP-1 diabetes and weight-loss drug side effects: ""Ozempic face"" and more - Harvard Health. GLP-1 diabetes and weight-loss drug side effects: ""Ozempic face"" and more Harvard Health",2024-02-05,news,glp diabetes weightloss drug side effect ozempic face harvard health glp diabetes weightloss drug side effect ozempic face harvard health,20
news_13,How do drugs like Ozempic work for weight loss? - Illinois News Bureau. How do drugs like Ozempic work for weight loss? Illinois News Bureau,2024-07-09,news,drug ozempic work weight loss illinois news bureau drug ozempic work weight loss illinois news bureau,16
news_14,Why do so many people stop taking weight-loss drugs within a year? - Northwestern Now News. Why do so many people stop taking weight-loss drugs within a year? Northwestern Now News,2024-11-08,news,many people stop taking weightloss drug within year northwestern news many people stop taking weightloss drug within year northwestern news,20
news_15,What happens when you stop taking weight-loss drugs? - BBC. What happens when you stop taking weight-loss drugs? BBC,2024-05-21,news,happens stop taking weightloss drug bbc happens stop taking weightloss drug bbc,12
news_16,Long-term weight loss effects of semaglutide in obesity without diabetes in the SELECT trial - Nature. Long-term weight loss effects of semaglutide in obesity without diabetes in the SELECT trial Nature,2024-05-13,news,longterm weight loss effect semaglutide obesity without diabetes select trial nature longterm weight loss effect semaglutide obesity without diabetes select trial nature,22
news_17,"Mounjaro leads to significantly more weight loss than Ozempic, study suggests - CNN. Mounjaro leads to significantly more weight loss than Ozempic, study suggests CNN",2024-07-08,news,mounjaro lead significantly weight loss ozempic study suggests cnn mounjaro lead significantly weight loss ozempic study suggests cnn,18
news_18,"No, taking drugs like Ozempic isn’t ‘cheating’ at weight loss or the ‘easy way out’ - The Conversation. No, taking drugs like Ozempic isn’t ‘cheating’ at weight loss or the ‘easy way out’ The Conversation",2024-04-10,news,taking drug ozempic isnt cheating weight loss easy way conversation taking drug ozempic isnt cheating weight loss easy way conversation,20
news_19,Which Weight Loss Drug Should You Choose (if You Get to Choose)? (Published 2024) - The New York Times. Which Weight Loss Drug Should You Choose (if You Get to Choose)? (Published 2024) The New York Times,2024-07-23,news,weight loss drug choose choose published new york time weight loss drug choose choose published new york time,18
news_20,Ozempic for Weight Loss: What You Need to Know - CU Anschutz newsroom. Ozempic for Weight Loss: What You Need to Know CU Anschutz newsroom,2024-04-09,news,ozempic weight loss need know anschutz newsroom ozempic weight loss need know anschutz newsroom,14
news_21,"I lost 42 pounds with Ozempic, but was shaken by the drug's psychological toll - TODAY.com. I lost 42 pounds with Ozempic, but was shaken by the drug's psychological toll TODAY.com",2024-06-20,news,lost pound ozempic shaken drug psychological toll todaycom lost pound ozempic shaken drug psychological toll todaycom,16
news_22,"Exclusive: Most patients stop using Wegovy, Ozempic for weight loss within two years - Reuters. Exclusive: Most patients stop using Wegovy, Ozempic for weight loss within two years Reuters",2024-07-10,news,exclusive patient stop using wegovy ozempic weight loss within two year reuters exclusive patient stop using wegovy ozempic weight loss within two year reuters,24
news_23,"How Ozempic, other weight-loss drugs are ""changing medicine"" - CBS News. How Ozempic, other weight-loss drugs are ""changing medicine"" CBS News",2024-01-21,news,ozempic weightloss drug changing medicine cbs news ozempic weightloss drug changing medicine cbs news,14
news_24,How ‘Ozempic shaming’ illuminates complexities of treating weight problems - Harvard Gazette. How ‘Ozempic shaming’ illuminates complexities of treating weight problems Harvard Gazette,2024-02-05,news,ozempic shaming illuminates complexity treating weight problem harvard gazette ozempic shaming illuminates complexity treating weight problem harvard gazette,18
news_25,WHO issues warning on falsified medicines used for diabetes treatment and weight loss - World Health Organization (WHO). WHO issues warning on falsified medicines used for diabetes treatment and weight loss World Health Organization (WHO),2024-06-20,news,issue warning falsified medicine used diabetes treatment weight loss world health organization issue warning falsified medicine used diabetes treatment weight loss world health organization,24
news_26,Mounjaro bests Ozempic for weight loss in first head-to-head comparison of real-world use - Los Angeles Times. Mounjaro bests Ozempic for weight loss in first head-to-head comparison of real-world use Los Angeles Times,2024-07-08,news,mounjaro best ozempic weight loss first headtohead comparison realworld use los angeles time mounjaro best ozempic weight loss first headtohead comparison realworld use los angeles time,26
news_27,What Are the Side Effects of New Weight Loss Medications? - AARP. What Are the Side Effects of New Weight Loss Medications? AARP,2024-01-17,news,side effect new weight loss medication aarp side effect new weight loss medication aarp,14
news_28,Can medications like Ozempic® and Wegovy® decrease your stroke risk? - Nebraska Medicine. Can medications like Ozempic® and Wegovy® decrease your stroke risk? Nebraska Medicine,2024-01-22,news,medication ozempic wegovy decrease stroke risk nebraska medicine medication ozempic wegovy decrease stroke risk nebraska medicine,16
news_29,The rise of Ozempic: how surprise discoveries and lizard venom led to a new class of weight-loss drugs - The Conversation. The rise of Ozempic: how surprise discoveries and lizard venom led to a new class of weight-loss drugs The Conversation,2024-04-01,news,rise ozempic surprise discovery lizard venom led new class weightloss drug conversation rise ozempic surprise discovery lizard venom led new class weightloss drug conversation,24
news_30,The new weight-loss drugs and cancer - Fred Hutchinson Cancer Center. The new weight-loss drugs and cancer Fred Hutchinson Cancer Center,2024-03-28,news,new weightloss drug cancer fred hutchinson cancer center new weightloss drug cancer fred hutchinson cancer center,16
news_31,Thinking Ozempic or Wegovy for Weight Loss? Poison Control Centers Urge Caution - University of Utah Health. Thinking Ozempic or Wegovy for Weight Loss? Poison Control Centers Urge Caution University of Utah Health,2024-09-12,news,thinking ozempic wegovy weight loss poison control center urge caution university utah health thinking ozempic wegovy weight loss poison control center urge caution university utah health,26
news_32,Understanding the Facts about Ozempic and Drugs Used for Weight Loss - Avera Health. Understanding the Facts about Ozempic and Drugs Used for Weight Loss Avera Health,2024-01-30,news,understanding fact ozempic drug used weight loss avera health understanding fact ozempic drug used weight loss avera health,18
news_33,Science for Living: What to know about Ozempic and other weight loss drugs - UMass Chan Medical School. Science for Living: What to know about Ozempic and other weight loss drugs UMass Chan Medical School,2024-02-12,news,science living know ozempic weight loss drug umass chan medical school science living know ozempic weight loss drug umass chan medical school,22
news_34,Ozempic: 5 Reasons People Don’t Lose Weight on GLP-1 Drugs - Healthline. Ozempic: 5 Reasons People Don’t Lose Weight on GLP-1 Drugs Healthline,2024-04-20,news,ozempic reason people dont lose weight glp drug healthline ozempic reason people dont lose weight glp drug healthline,18
news_35,"What's better for weight loss, Mounjaro or Ozempic? New study provides answer - ABC News. What's better for weight loss, Mounjaro or Ozempic? New study provides answer ABC News",2024-07-09,news,whats better weight loss mounjaro ozempic new study provides answer abc news whats better weight loss mounjaro ozempic new study provides answer abc news,24
news_36,Interested in the new weight loss drugs? Here are 5 things to know - CNN. Interested in the new weight loss drugs? Here are 5 things to know CNN,2024-02-03,news,interested new weight loss drug thing know cnn interested new weight loss drug thing know cnn,16
news_37,Health benefits of semaglutide — Beyond weight loss - Mayo Clinic Press. Health benefits of semaglutide — Beyond weight loss Mayo Clinic Press,2024-07-02,news,health benefit semaglutide beyond weight loss mayo clinic press health benefit semaglutide beyond weight loss mayo clinic press,18
news_38,They Thought Ozempic Would Help Them Lose Weight. It Didn’t Work. - The Wall Street Journal. They Thought Ozempic Would Help Them Lose Weight. It Didn’t Work. The Wall Street Journal,2024-04-01,news,thought ozempic help lose weight didnt work wall street journal thought ozempic help lose weight didnt work wall street journal,20
news_39,Rybelsus vs. Ozempic For Weight Loss: What’s The Difference? - Forbes. Rybelsus vs. Ozempic For Weight Loss: What’s The Difference? Forbes,2024-01-08,news,rybelsus ozempic weight loss whats difference forbes rybelsus ozempic weight loss whats difference forbes,14
news_40,Zepbound outperforms Ozempic and Wegovy in head-to-head weight loss study - NBC News. Zepbound outperforms Ozempic and Wegovy in head-to-head weight loss study NBC News,2024-07-08,news,zepbound outperforms ozempic wegovy headtohead weight loss study nbc news zepbound outperforms ozempic wegovy headtohead weight loss study nbc news,20
news_41,How Does Ozempic Work? (Published 2024) - The New York Times. How Does Ozempic Work? (Published 2024) The New York Times,2024-05-29,news,ozempic work published new york time ozempic work published new york time,12
news_42,"Mounjaro Better for Weight Loss Than Ozempic, Study Finds - Healthline. Mounjaro Better for Weight Loss Than Ozempic, Study Finds Healthline",2024-07-08,news,mounjaro better weight loss ozempic study find healthline mounjaro better weight loss ozempic study find healthline,16
news_43,Ozempic: 4 Key Factors Affect How Much Weight You Lose on GLP-1 Drugs - Healthline. Ozempic: 4 Key Factors Affect How Much Weight You Lose on GLP-1 Drugs Healthline,2024-09-17,news,ozempic key factor affect much weight lose glp drug healthline ozempic key factor affect much weight lose glp drug healthline,20
news_44,"Teenagers Are Taking New Weight-Loss Drugs, but the Science Is Far from Settled - Scientific American. Teenagers Are Taking New Weight-Loss Drugs, but the Science Is Far from Settled Scientific American",2024-10-25,news,teenager taking new weightloss drug science far settled scientific american teenager taking new weightloss drug science far settled scientific american,20
news_45,Ozempic and Mounjaro Aren’t the Same. Here’s How Weight-Loss Drugs Compare - Scientific American. Ozempic and Mounjaro Aren’t the Same. Here’s How Weight-Loss Drugs Compare Scientific American,2024-02-28,news,ozempic mounjaro arent here weightloss drug compare scientific american ozempic mounjaro arent here weightloss drug compare scientific american,18
news_46,New obesity drugs are seemingly everywhere. Black Americans feel left out - statnews.com. New obesity drugs are seemingly everywhere. Black Americans feel left out statnews.com,2024-05-29,news,new obesity drug seemingly everywhere black american feel left statnewscom new obesity drug seemingly everywhere black american feel left statnewscom,20
news_47,Top doctor alarmed by weight-loss drug misuse - BBC. Top doctor alarmed by weight-loss drug misuse BBC,2024-06-14,news,top doctor alarmed weightloss drug misuse bbc top doctor alarmed weightloss drug misuse bbc,14
news_48,"Ozempic, Mounjaro users talk about changes to family life after weight loss - ABC News. Ozempic, Mounjaro users talk about changes to family life after weight loss ABC News",2024-03-01,news,ozempic mounjaro user talk change family life weight loss abc news ozempic mounjaro user talk change family life weight loss abc news,22
news_49,Ozempic weight loss plateau: What is it and how to get past it - Medical News Today. Ozempic weight loss plateau: What is it and how to get past it Medical News Today,2024-01-02,news,ozempic weight loss plateau past medical news today ozempic weight loss plateau past medical news today,16
news_50,18 celebrities who've opened up about taking Ozempic or weight-loss drugs - Yahoo. 18 celebrities who've opened up about taking Ozempic or weight-loss drugs Yahoo,2024-05-21,news,celebrity whove opened taking ozempic weightloss drug yahoo celebrity whove opened taking ozempic weightloss drug yahoo,16
news_51,More teens are turning to weight loss drugs - NBC News. More teens are turning to weight loss drugs NBC News,2024-02-21,news,teen turning weight loss drug nbc news teen turning weight loss drug nbc news,14
news_52,"The new obesity drugs work, but it's a dilemma when people have to stop taking them - NPR. The new obesity drugs work, but it's a dilemma when people have to stop taking them NPR",2024-05-27,news,new obesity drug work dilemma people stop taking npr new obesity drug work dilemma people stop taking npr,18
news_53,Research shows GLP-1 receptor agonist drugs are effective but come with complex concerns - UChicago Medicine. Research shows GLP-1 receptor agonist drugs are effective but come with complex concerns UChicago Medicine,2024-05-30,news,research show glp receptor agonist drug effective come complex concern uchicago medicine research show glp receptor agonist drug effective come complex concern uchicago medicine,24
news_54,Ricki Lake Says Her Doctor Was 'Pushing' Her to Take Ozempic - Healthline. Ricki Lake Says Her Doctor Was 'Pushing' Her to Take Ozempic Healthline,2024-05-13,news,ricki lake say doctor pushing take ozempic healthline ricki lake say doctor pushing take ozempic healthline,16
news_55,Mounjaro is more effective for weight loss than Ozempic. So how does it work? And why does it cost so much? - The Conversation. Mounjaro is more effective for weight loss than Ozempic. So how does it work? And why does it cost so much? The Conversation,2024-10-15,news,mounjaro effective weight loss ozempic work cost much conversation mounjaro effective weight loss ozempic work cost much conversation,18
news_56,Gross Medicare Spending on Ozempic and Other GLP-1s Is Already Skyrocketing – Even Though Medicare Cannot Cover The Drugs for Weight Loss - KFF. Gross Medicare Spending on Ozempic and Other GLP-1s Is Already Skyrocketing – Even Though Medicare Cannot Cover The Drugs for Weight Loss KFF,2024-03-23,news,gross medicare spending ozempic glps already skyrocketing though medicare cover drug weight loss kff gross medicare spending ozempic glps already skyrocketing though medicare cover drug weight loss kff,28
news_57,Biden proposes weight-loss drugs be covered by Medicare or Medicaid for millions of obese Americans - PBS. Biden proposes weight-loss drugs be covered by Medicare or Medicaid for millions of obese Americans PBS,2024-11-26,news,biden proposes weightloss drug covered medicare medicaid million obese american pb biden proposes weightloss drug covered medicare medicaid million obese american pb,22
news_58,Rebel Wilson shared she briefly used Ozempic in weight loss journey - ABC News. Rebel Wilson shared she briefly used Ozempic in weight loss journey ABC News,2024-03-31,news,rebel wilson shared briefly used ozempic weight loss journey abc news rebel wilson shared briefly used ozempic weight loss journey abc news,22
news_59,"Losing weight on Ozempic is risky, Baylor experts warn - The Baylor Lariat. Losing weight on Ozempic is risky, Baylor experts warn The Baylor Lariat",2024-11-13,news,losing weight ozempic risky baylor expert warn baylor lariat losing weight ozempic risky baylor expert warn baylor lariat,18
news_60,KFF Health Tracking Poll May 2024: The Public’s Use and Views of GLP-1 Drugs - KFF. KFF Health Tracking Poll May 2024: The Public’s Use and Views of GLP-1 Drugs KFF,2024-05-10,news,kff health tracking poll may public use view glp drug kff kff health tracking poll may public use view glp drug kff,22
news_61,Fatty Liver Disease: The Process Behind the Benefit of Weight Loss Drugs - Yale School of Medicine. Fatty Liver Disease: The Process Behind the Benefit of Weight Loss Drugs Yale School of Medicine,2024-09-17,news,fatty liver disease process behind benefit weight loss drug yale school medicine fatty liver disease process behind benefit weight loss drug yale school medicine,24
news_62,Ozempic and Wegovy: 5 Health Benefits Besides Weight Loss - Healthline. Ozempic and Wegovy: 5 Health Benefits Besides Weight Loss Healthline,2024-03-19,news,ozempic wegovy health benefit besides weight loss healthline ozempic wegovy health benefit besides weight loss healthline,16
news_63,"Expanding Access to Weight-Loss Drugs Could Save Thousands of Lives A Year, Study Finds - Yale School of Medicine. Expanding Access to Weight-Loss Drugs Could Save Thousands of Lives A Year, Study Finds Yale School of Medicine",2024-10-16,news,expanding access weightloss drug could save thousand life year study find yale school medicine expanding access weightloss drug could save thousand life year study find yale school medicine,28
news_64,"FDA reviewing Ozempic, other diabetes and weight-loss drugs for side effects like suicidal thoughts, hair loss - ABC7 Los Angeles. FDA reviewing Ozempic, other diabetes and weight-loss drugs for side effects like suicidal thoughts, hair loss ABC7 Los Angeles",2024-01-04,news,fda reviewing ozempic diabetes weightloss drug side effect suicidal thought hair loss abc los angeles fda reviewing ozempic diabetes weightloss drug side effect suicidal thought hair loss abc los angeles,30
news_65,How ‘miracle’ weight-loss drugs will change the world - Nature. How ‘miracle’ weight-loss drugs will change the world Nature,2024-11-05,news,miracle weightloss drug change world nature miracle weightloss drug change world nature,12
news_66,Experimental weight loss pill seems to be more potent than Ozempic - New Scientist. Experimental weight loss pill seems to be more potent than Ozempic New Scientist,2024-03-07,news,experimental weight loss pill seems potent ozempic new scientist experimental weight loss pill seems potent ozempic new scientist,18
news_67,Considering taking Wegovy to lose weight? Here are the risks and benefits – and how it differs from Ozempic - The Conversation. Considering taking Wegovy to lose weight? Here are the risks and benefits – and how it differs from Ozempic The Conversation,2024-08-27,news,considering taking wegovy lose weight risk benefit differs ozempic conversation considering taking wegovy lose weight risk benefit differs ozempic conversation,20
news_68,Ozempic's popularity leads to shortages for people with Type 2 diabetes - NPR. Ozempic's popularity leads to shortages for people with Type 2 diabetes NPR,2024-07-10,news,ozempics popularity lead shortage people type diabetes npr ozempics popularity lead shortage people type diabetes npr,16
news_69,Why Diabetes Miracle Drugs like Ozempic Are Off-Limits to Type 1s - diaTribe. Why Diabetes Miracle Drugs like Ozempic Are Off-Limits to Type 1s diaTribe,2024-06-18,news,diabetes miracle drug ozempic offlimits type diatribe diabetes miracle drug ozempic offlimits type diatribe,14
news_70,Not Everyone Loses Weight on Ozempic - WIRED. Not Everyone Loses Weight on Ozempic WIRED,2024-07-01,news,everyone loses weight ozempic wired everyone loses weight ozempic wired,10
news_71,Chocolatier loses 105 pounds with Ozempic after struggling with weight all her life - TODAY.com. Chocolatier loses 105 pounds with Ozempic after struggling with weight all her life TODAY.com,2024-02-07,news,chocolatier loses pound ozempic struggling weight life todaycom chocolatier loses pound ozempic struggling weight life todaycom,16
news_72,Ozempic is coming for gyms. Here’s how they’re responding - CNN. Ozempic is coming for gyms. Here’s how they’re responding CNN,2024-03-01,news,ozempic coming gym here theyre responding cnn ozempic coming gym here theyre responding cnn,14
news_73,Ozempic vs. Mounjaro: Head-to-Head Study Shows Weight Loss Winner - Health: Trusted and Empathetic Health and Wellness Information. Ozempic vs. Mounjaro: Head-to-Head Study Shows Weight Loss Winner Health: Trusted and Empathetic Health and Wellness Information,2024-07-12,news,ozempic mounjaro headtohead study show weight loss winner health trusted empathetic health wellness information ozempic mounjaro headtohead study show weight loss winner health trusted empathetic health wellness information,28
news_74,Mayo Clinic Minute: Weaning off popular weight-loss medications - Mayo Clinic News Network. Mayo Clinic Minute: Weaning off popular weight-loss medications Mayo Clinic News Network,2024-08-08,news,mayo clinic minute weaning popular weightloss medication mayo clinic news network mayo clinic minute weaning popular weightloss medication mayo clinic news network,22
news_75,Rapid weight loss can lead to loss of muscle mass - UCLA Health. Rapid weight loss can lead to loss of muscle mass UCLA Health,2024-05-01,news,rapid weight loss lead loss muscle mass ucla health rapid weight loss lead loss muscle mass ucla health,18
