id,source,text,date,drug_mentioned,category
news_218,Healio,"SELECT: Semaglutide provides CV benefits for adults with obesity, regardless of HbA1c - Healio. SELECT: Semaglutide provides CV benefits for adults with obesity, regardless of HbA1c Healio",2024-06-26,Semaglutide,Health
news_219,WebMD,Wegovy for Obesity in Kids? - WebMD. Wegovy for Obesity in Kids? WebMD,2024-02-18,Wegovy,Health
news_220,Medscape,Semaglutide CV Benefits Irrespective of Weight Lost? - Medscape. Semaglutide CV Benefits Irrespective of Weight Lost? Medscape,2024-05-14,Semaglutide,Health
news_221,Cureus,Efficacy of Different Doses and Forms of the GLP-1 Receptor Agonist Semaglutide in Weight Reduction Among Non-diabetic Obese or Overweight Populations - Cureus. Efficacy of Different Doses and Forms of the GLP-1 Receptor Agonist Semaglutide in Weight Reduction Among Non-diabetic Obese or Overweight Populations Cureus,2024-09-06,Semaglutide,Health
news_222,Mass General Brigham,Study Shows Weight Loss Drug Decreases Heart Disease Risk - Mass General Brigham. Study Shows Weight Loss Drug Decreases Heart Disease Risk Mass General Brigham,2024-04-25,GLP-1,Science
news_223,2 Minute Medicine,Visual Abstract: Semaglutide Imrpoves Weight Loss Gains and Pain Related to Knee Osteoarthritis in Patients with Obesity - 2 Minute Medicine. Visual Abstract: Semaglutide Imrpoves Weight Loss Gains and Pain Related to Knee Osteoarthritis in Patients with Obesity 2 Minute Medicine,2024-11-20,Semaglutide,Health
news_224,National Institutes of Health (NIH) | (.gov),People taking semaglutide had lower risk of suicidal thoughts - National Institutes of Health (NIH) | (.gov). People taking semaglutide had lower risk of suicidal thoughts National Institutes of Health (NIH) | (.gov),2024-01-23,Semaglutide,Health
news_225,ScienceDirect.com,Therapy for HFpEF: A step forward brings new hope for people with obesity and diabetes - ScienceDirect.com. Therapy for HFpEF: A step forward brings new hope for people with obesity and diabetes ScienceDirect.com,2024-08-09,GLP-1,Health
news_226,Medscape,Semaglutide 2.4 mg Reduces All-Cause Hospital Admissions - Medscape. Semaglutide 2.4 mg Reduces All-Cause Hospital Admissions Medscape,2024-11-04,Semaglutide,Health
news_227,Nature,Semaglutide effects on safety and cardiovascular outcomes in patients with overweight or obesity: a systematic review and meta-analysis | International Journal of Obesity - Nature. Semaglutide effects on safety and cardiovascular outcomes in patients with overweight or obesity: a systematic review and meta-analysis | International Journal of Obesity Nature,2024-10-12,Semaglutide,Health
news_228,MedPage Today,ObesityWeek Roundup: Patients More Likely to Ration Weight-Loss Drugs - MedPage Today. ObesityWeek Roundup: Patients More Likely to Ration Weight-Loss Drugs MedPage Today,2024-11-12,GLP-1,Health
news_229,TCTMD.com,Semaglutide Has Similar Benefits in Women and Men With HFpEF - TCTMD.com. Semaglutide Has Similar Benefits in Women and Men With HFpEF TCTMD.com,2024-06-26,Semaglutide,Health
news_230,Healio,Q&A: Phenotype test predicting semaglutide response could ‘change conversation’ on obesity - Healio. Q&A: Phenotype test predicting semaglutide response could ‘change conversation’ on obesity Healio,2024-07-09,Semaglutide,Health
news_231,Applied Clinical Trials Online,"Once-Weekly Semaglutide Reduces Knee Osteoarthritis Pain, Body Weight in Patients with Obesity, Suggesting Potential to Lower NSAID Use - Applied Clinical Trials Online. Once-Weekly Semaglutide Reduces Knee Osteoarthritis Pain, Body Weight in Patients with Obesity, Suggesting Potential to Lower NSAID Use Applied Clinical Trials Online",2024-11-06,Semaglutide,Science
news_232,UT Southwestern,Semaglutide lowers cardiovascular risk regardless of blood sugar : Newsroom - UT Southwestern. Semaglutide lowers cardiovascular risk regardless of blood sugar : Newsroom UT Southwestern,2024-06-22,Semaglutide,Health
news_233,The American Journal of Managed Care® (AJMC®),Medicare Semaglutide Coverage: Millions May Gain Access That Could Cost $145 Billion - The American Journal of Managed Care® (AJMC®). Medicare Semaglutide Coverage: Millions May Gain Access That Could Cost $145 Billion The American Journal of Managed Care® (AJMC®),2024-08-26,Semaglutide,Business
news_234,Cleveland Clinic,A New Tool in the Obesity Management Toolbox - Cleveland Clinic. A New Tool in the Obesity Management Toolbox Cleveland Clinic,2024-01-15,GLP-1,Health
news_235,Frontiers,The maintenance of long-term weight loss after semaglutide withdrawal in obese women with PCOS treated with metformin: a 2-year observational study - Frontiers. The maintenance of long-term weight loss after semaglutide withdrawal in obese women with PCOS treated with metformin: a 2-year observational study Frontiers,2024-04-10,Semaglutide,Science
news_236,BioPharma Dive,"Novo, with new results, to seek approval for obesity drug in MASH - BioPharma Dive. Novo, with new results, to seek approval for obesity drug in MASH BioPharma Dive",2024-11-01,GLP-1,Regulation
news_237,Pharmacy Times,"Study: Unexpected Safety Signals Identified for Semaglutide in Diabetes, Obesity - Pharmacy Times. Study: Unexpected Safety Signals Identified for Semaglutide in Diabetes, Obesity Pharmacy Times",2024-07-15,Semaglutide,Science
news_238,Cardiovascular Business,Diabetes drug tirzepatide linked to more significant weight loss than semaglutide - Cardiovascular Business. Diabetes drug tirzepatide linked to more significant weight loss than semaglutide Cardiovascular Business,2024-07-11,Semaglutide,Health
news_239,Nature,RETRACTED ARTICLE: Effect of combined GLP-1 analogue and bupropion/naltrexone on weight loss: a retrospective cohort study | International Journal of Obesity - Nature. RETRACTED ARTICLE: Effect of combined GLP-1 analogue and bupropion/naltrexone on weight loss: a retrospective cohort study | International Journal of Obesity Nature,2024-05-09,GLP-1,Science
news_240,Healio,Real-world data reveal preventive potential of semaglutide for CV events - Healio. Real-world data reveal preventive potential of semaglutide for CV events Healio,2024-02-26,Semaglutide,Health
news_241,Stony Brook Medicine,Semaglutide for Weight Loss: Is It Safe? - Stony Brook Medicine. Semaglutide for Weight Loss: Is It Safe? Stony Brook Medicine,2024-10-02,Semaglutide,Health
news_242,University College London,‘Weight loss’ drug semaglutide linked to better heart health | UCL News - UCL - University College London. ‘Weight loss’ drug semaglutide linked to better heart health | UCL News - UCL University College London,2024-05-14,Semaglutide,Health
news_243,Medscape,Semaglutide Improves Taste Sensitivity in Women With Obesity - Medscape. Semaglutide Improves Taste Sensitivity in Women With Obesity Medscape,2024-06-02,Semaglutide,Health
news_244,WHYY,A Philly lab reveals how obesity drugs like Ozempic cause nausea - WHYY. A Philly lab reveals how obesity drugs like Ozempic cause nausea WHYY,2024-07-17,Ozempic,Health
news_245,Mayo Clinic,Association between individualized metabolic surgery scores and weight-loss outcomes in patients treated with semaglutide - Mayo Clinic. Association between individualized metabolic surgery scores and weight-loss outcomes in patients treated with semaglutide Mayo Clinic,2024-06-26,Semaglutide,Health
news_246,UT Southwestern,Study identifies weight-loss drug target in the brain: Newsroom - UT Southwestern. Study identifies weight-loss drug target in the brain: Newsroom UT Southwestern,2024-08-08,GLP-1,Science
news_247,Wiley Online Library,Efficacy and safety of semaglutide in patients with heart failure with preserved ejection fraction and obesity - Wiley Online Library. Efficacy and safety of semaglutide in patients with heart failure with preserved ejection fraction and obesity Wiley Online Library,2024-05-20,Semaglutide,Health
news_248,UT Health San Antonio,"Clinical trial to investigate causes of diabetes, obesity in individuals with spinal cord injury and potential mitigatory effects of semaglutide - UT Health San Antonio. Clinical trial to investigate causes of diabetes, obesity in individuals with spinal cord injury and potential mitigatory effects of semaglutide UT Health San Antonio",2024-09-04,Semaglutide,Science
news_249,Fierce Pharma,Novo rekindles heart failure hopes for semaglutide with new pooled analysis - Fierce Pharma. Novo rekindles heart failure hopes for semaglutide with new pooled analysis Fierce Pharma,2024-08-30,Semaglutide,Health
news_250,Healio,"Weight loss with semaglutide reduces pain, improves function in knee osteoarthritis - Healio. Weight loss with semaglutide reduces pain, improves function in knee osteoarthritis Healio",2024-11-14,Semaglutide,Health
news_251,News-Medical,"Semaglutide improves heart health and reduces weight in obese patients, but with side effects - News-Medical. Semaglutide improves heart health and reduces weight in obese patients, but with side effects News-Medical",2024-10-14,Semaglutide,Health
news_252,Northwestern University,Treating Cardiovascular Health with Anti-Obesity Medications and Addressing Health Equity - Northwestern University. Treating Cardiovascular Health with Anti-Obesity Medications and Addressing Health Equity Northwestern University,2024-03-12,GLP-1,Health
news_253,Northwestern University,Weight Loss Drug Shows Benefits for Heart Failure - Northwestern University. Weight Loss Drug Shows Benefits for Heart Failure Northwestern University,2024-05-08,GLP-1,Health
news_254,The Lancet,"Healthy weight loss maintenance with exercise, GLP-1 receptor agonist, or both combined followed by one year without treatment: a post-treatment analysis of a randomised placebo-controlled trial - eClinicalMedicine - The Lancet. Healthy weight loss maintenance with exercise, GLP-1 receptor agonist, or both combined followed by one year without treatment: a post-treatment analysis of a randomised placebo-controlled trial - eClinicalMedicine The Lancet",2024-02-19,GLP-1,Science
news_255,Nature,"How rival weight-loss drugs fare at treating obesity, diabetes and more - Nature. How rival weight-loss drugs fare at treating obesity, diabetes and more Nature",2024-09-03,GLP-1,Health
news_256,Nature,Obesity-related T cell dysfunction impairs immunosurveillance and increases cancer risk - Nature. Obesity-related T cell dysfunction impairs immunosurveillance and increases cancer risk Nature,2024-04-02,GLP-1,Health
news_257,News-Medical,Semaglutide shows significant weight loss and health benefits in four-year obesity study - News-Medical. Semaglutide shows significant weight loss and health benefits in four-year obesity study News-Medical,2024-05-14,Semaglutide,Science
news_258,Nature,Experimental obesity drug packs double punch to reduce weight - Nature. Experimental obesity drug packs double punch to reduce weight Nature,2024-05-15,GLP-1,Health
news_259,The American Journal of Managed Care® (AJMC®),Can Different Pricing Models Address the Obesity Problem in America? - The American Journal of Managed Care® (AJMC®). Can Different Pricing Models Address the Obesity Problem in America? The American Journal of Managed Care® (AJMC®),2024-03-06,GLP-1,Health
news_260,Healio,Wegovy likely not cost-effective in the SELECT trial population - Healio. Wegovy likely not cost-effective in the SELECT trial population Healio,2024-08-29,Wegovy,Science
news_261,PwC,What is the future of GLP-1 trends and its impact on business models - PwC. What is the future of GLP-1 trends and its impact on business models PwC,2024-10-26,GLP-1,Health
news_262,UCI Health,GLP-1 weight-loss drug use among youth spark long-term safety concerns - UCI Health. GLP-1 weight-loss drug use among youth spark long-term safety concerns UCI Health,2024-09-20,GLP-1,Health
news_263,Boston University,Professor Receives Grant to Study Effectiveness of GLP-1 Weight-Loss Drugs - Boston University. Professor Receives Grant to Study Effectiveness of GLP-1 Weight-Loss Drugs Boston University,2024-05-17,GLP-1,Science
news_264,Tufts Now,Tufts Experts Weigh in on New Generation of Weight Loss Medications - Tufts Now. Tufts Experts Weigh in on New Generation of Weight Loss Medications Tufts Now,2024-07-08,GLP-1,Health
news_265,Endocrinology Advisor,GLP-1 Drug Shortages: How Do They Affect Patients With Diabetes? - Endocrinology Advisor. GLP-1 Drug Shortages: How Do They Affect Patients With Diabetes? Endocrinology Advisor,2024-11-08,GLP-1,Health
news_266,U.S. Chamber of Commerce,The Impact of Weight-Loss Drugs on Brands: Opportunities and Challenges - U.S. Chamber of Commerce. The Impact of Weight-Loss Drugs on Brands: Opportunities and Challenges U.S. Chamber of Commerce,2024-09-10,GLP-1,Health
news_267,NYU,Weighing the Social Costs of Weight Loss Drugs - NYU. Weighing the Social Costs of Weight Loss Drugs NYU,2024-08-20,GLP-1,Health
news_268,CNBC,"Here's how much people are willing to spend on weight loss drugs, according to a new survey - CNBC. Here's how much people are willing to spend on weight loss drugs, according to a new survey CNBC",2024-03-23,GLP-1,Health
news_269,CNN,"GLP-1 pills are coming, and they could revolutionize weight-loss treatment - CNN. GLP-1 pills are coming, and they could revolutionize weight-loss treatment CNN",2024-09-17,GLP-1,Health
news_270,Hims Investor Relations,"Hims & Hers Announces Access to GLP-1 Injections, Passing Cost Savings Onto Customers - Hims Investor Relations. Hims & Hers Announces Access to GLP-1 Injections, Passing Cost Savings Onto Customers Hims Investor Relations",2024-05-20,GLP-1,Health
news_271,CHOC - Children's Health Hub,Weight loss medications for treating teen obesity: What parents should know - CHOC - Children's Health Hub. Weight loss medications for treating teen obesity: What parents should know CHOC - Children's Health Hub,2024-03-14,GLP-1,Health
news_272,KFF,"Poll: 1 in 8 Adults Say They’ve Taken a GLP-1 Drug, Including 4 in 10 of Those with Diabetes and 1 in 4 of Those with Heart Disease - KFF. Poll: 1 in 8 Adults Say They’ve Taken a GLP-1 Drug, Including 4 in 10 of Those with Diabetes and 1 in 4 of Those with Heart Disease KFF",2024-05-10,GLP-1,Health
news_273,Science | AAAS,Winning researchers unlocked GLP-1 drugs for obesity - Science | AAAS. Winning researchers unlocked GLP-1 drugs for obesity Science | AAAS,2024-05-30,GLP-1,Science
news_274,MD Anderson Cancer Center,"Weight loss injections and cancer: 6 questions, answered - MD Anderson Cancer Center. Weight loss injections and cancer: 6 questions, answered MD Anderson Cancer Center",2024-11-11,GLP-1,Health
news_275,Sustainalytics,Why Looks Could Kill: An ESG Perspective on GLP-1 Medications for Cosmetic Weight Loss and Diabetes - Sustainalytics. Why Looks Could Kill: An ESG Perspective on GLP-1 Medications for Cosmetic Weight Loss and Diabetes Sustainalytics,2024-07-18,GLP-1,Health
news_276,www.heart.org,New weight loss medication may help lower blood pressure in adults with obesity - www.heart.org. New weight loss medication may help lower blood pressure in adults with obesity www.heart.org,2024-02-05,GLP-1,Health
news_277,Medscape,"Why Do GLP-1 Drugs Stop Working, and What to Do About It? - Medscape. Why Do GLP-1 Drugs Stop Working, and What to Do About It? Medscape",2024-01-12,GLP-1,Health
news_278,American Hospital Association,3 Ways GLP-1 Drugs Could Impact Your Hospital’s Future - American Hospital Association. 3 Ways GLP-1 Drugs Could Impact Your Hospital’s Future American Hospital Association,2024-05-21,GLP-1,Health
news_279,Harvard Gazette,Excited about a new diet drug? This procedure may be better. - Harvard Gazette. Excited about a new diet drug? This procedure may be better. Harvard Gazette,2024-05-06,GLP-1,Health
news_280,European Medicines Agency,EU actions to tackle shortages of GLP-1 receptor agonists - European Medicines Agency. EU actions to tackle shortages of GLP-1 receptor agonists European Medicines Agency,2024-06-26,GLP-1,Health
news_281,Medscape,Doctors' Tips for Accessing Costly GLP-1 Therapies - Medscape. Doctors' Tips for Accessing Costly GLP-1 Therapies Medscape,2024-06-03,GLP-1,Health
news_282,Penn State Health News,Q&A: Can weight loss drugs help in addiction treatment? - Penn State Health News. Q&A: Can weight loss drugs help in addiction treatment? Penn State Health News,2024-04-11,GLP-1,Health
news_283,healthsystemtracker.org,Insurer strategies to control costs associated with weight loss drugs - healthsystemtracker.org. Insurer strategies to control costs associated with weight loss drugs healthsystemtracker.org,2024-06-12,GLP-1,Health
news_284,Hackensack Meridian Health,How to Use Weight-Loss Medication Safely - Hackensack Meridian Health. How to Use Weight-Loss Medication Safely Hackensack Meridian Health,2024-01-22,GLP-1,Health
news_285,VCU Health,Research Suggests Enhancing Diabetes and Weight Loss Drug may be a Game Changer for Liver Disease - VCU Health. Research Suggests Enhancing Diabetes and Weight Loss Drug may be a Game Changer for Liver Disease VCU Health,2024-06-07,GLP-1,Science
news_286,HSS | Hospital for Special Surgery,What to Know About Weight-Loss Drugs and Joint Pain - HSS | Hospital for Special Surgery. What to Know About Weight-Loss Drugs and Joint Pain HSS | Hospital for Special Surgery,2024-08-19,GLP-1,Health
news_287,USC Schaeffer,Medicare Coverage of Weight Loss Drugs Could Save the U.S. Billions of Dollars - USC Schaeffer. Medicare Coverage of Weight Loss Drugs Could Save the U.S. Billions of Dollars USC Schaeffer,2024-04-03,GLP-1,Business
news_288,University of Kansas Medical Center,Prescription for Success - University of Kansas Medical Center. Prescription for Success University of Kansas Medical Center,2024-07-12,GLP-1,Health
news_289,Harvard T.H. Chan School of Public Health,Rise in obesity drug use linked with decrease in weight-loss surgery - Harvard T.H. Chan School of Public Health. Rise in obesity drug use linked with decrease in weight-loss surgery Harvard T.H. Chan School of Public Health,2024-11-01,GLP-1,Health
news_290,The World Economic Forum,Why GLP-1 is not the only answer for treating obesity - The World Economic Forum. Why GLP-1 is not the only answer for treating obesity The World Economic Forum,2024-01-10,GLP-1,Health
news_291,KFF,Insurer Strategies to Control Costs Associated with Weight Loss Drugs - KFF. Insurer Strategies to Control Costs Associated with Weight Loss Drugs KFF,2024-06-12,GLP-1,Regulation
news_292,The Hill,How weight loss drugs are showing promise beyond shedding pounds - The Hill. How weight loss drugs are showing promise beyond shedding pounds The Hill,2024-08-07,GLP-1,Health
news_293,IQVIA,Decoding the Buzz Around Weight-loss Medications: Unpacking the Revolution of GLP-1 Medications - IQVIA. Decoding the Buzz Around Weight-loss Medications: Unpacking the Revolution of GLP-1 Medications IQVIA,2024-03-28,GLP-1,Health
news_294,The American Journal of Managed Care® (AJMC®),"Rising Costs Lead Insurers to Drop Weight Loss Drug Coverage, Further Increasing Patient Burden - The American Journal of Managed Care® (AJMC®). Rising Costs Lead Insurers to Drop Weight Loss Drug Coverage, Further Increasing Patient Burden The American Journal of Managed Care® (AJMC®)",2024-08-06,GLP-1,Health
news_295,CNN,Insurance denials for popular new weight loss medications leave patients with risky choices - CNN. Insurance denials for popular new weight loss medications leave patients with risky choices CNN,2024-01-08,GLP-1,Health
news_296,michiganmedicine.org,Should heart patients consider taking weight loss medications? - michiganmedicine.org. Should heart patients consider taking weight loss medications? michiganmedicine.org,2024-02-07,GLP-1,Health
news_297,Penn LDI,Key Lessons for Ethical and Affordable Access to GLP-1 Drugs Like Ozempic and Wegovy - Penn LDI. Key Lessons for Ethical and Affordable Access to GLP-1 Drugs Like Ozempic and Wegovy Penn LDI,2024-10-17,Ozempic,Health
news_298,UCLA Health,Patients taking weight loss medications require proper nutrition - UCLA Health. Patients taking weight loss medications require proper nutrition UCLA Health,2024-07-23,GLP-1,Health
news_299,The American Journal of Managed Care® (AJMC®),FDA Advised to Update Labels on GLP-1 Weight-Loss Drugs - The American Journal of Managed Care® (AJMC®). FDA Advised to Update Labels on GLP-1 Weight-Loss Drugs The American Journal of Managed Care® (AJMC®),2024-11-25,GLP-1,Regulation
news_300,CNN,"Many people using GLP-1s for weight loss stop treatment too soon, research shows, and results are not one-size-fits-all - CNN. Many people using GLP-1s for weight loss stop treatment too soon, research shows, and results are not one-size-fits-all CNN",2024-05-21,GLP-1,Science
news_301,PNAS,Estimating the lives that could be saved by expanded access to weight-loss drugs - PNAS. Estimating the lives that could be saved by expanded access to weight-loss drugs PNAS,2024-10-20,GLP-1,Health
news_302,CNN,Your employer may start covering weight-loss drugs soon - CNN. Your employer may start covering weight-loss drugs soon CNN,2024-10-09,GLP-1,Health
news_303,American Medical Association,"How to find reliable health information, weight loss drug research and GLP-1 side effects - American Medical Association. How to find reliable health information, weight loss drug research and GLP-1 side effects American Medical Association",2024-05-24,GLP-1,Science
news_304,University College London,"Weight loss drugs alone are not enough for individuals to achieve health goals, researchers say - University College London. Weight loss drugs alone are not enough for individuals to achieve health goals, researchers say University College London",2024-08-13,GLP-1,Science
news_305,Swiss Re,Weight loss injectables - Swiss Re. Weight loss injectables Swiss Re,2024-10-22,GLP-1,Health
news_306,News-Medical,Expanding access to GLP-1 weight-loss drugs could save thousands of lives - News-Medical. Expanding access to GLP-1 weight-loss drugs could save thousands of lives News-Medical,2024-10-16,GLP-1,Health
news_307,Northeastern Global News,Older weight loss drugs are in demand. But are they safe or effective? And should you take them? - Northeastern Global News. Older weight loss drugs are in demand. But are they safe or effective? And should you take them? Northeastern Global News,2024-07-08,GLP-1,Health
news_308,The American College of Surgeons,Bariatric Surgery Is More Cost Effective Than Newer Weight Loss Drugs Alone - The American College of Surgeons. Bariatric Surgery Is More Cost Effective Than Newer Weight Loss Drugs Alone The American College of Surgeons,2024-10-18,GLP-1,Health
news_309,ECRI,Monitoring Patients Who Take GLP-1 RAs for Weight Loss – What Prescribers Should Know - ECRI. Monitoring Patients Who Take GLP-1 RAs for Weight Loss – What Prescribers Should Know ECRI,2024-03-05,GLP-1,Health
news_310,CBS News,West Virginia residents struggle to afford GLP-1 weight loss drugs after state ends subsidy program - CBS News. West Virginia residents struggle to afford GLP-1 weight loss drugs after state ends subsidy program CBS News,2024-11-25,GLP-1,Health
news_311,Science | AAAS,Weight loss drugs without the nausea? Mouse study suggests it may be possible - Science | AAAS. Weight loss drugs without the nausea? Mouse study suggests it may be possible Science | AAAS,2024-07-10,GLP-1,Science
news_312,CNN,"Popular weight-loss and diabetes medications linked to lower risk of some cancers, study finds - CNN. Popular weight-loss and diabetes medications linked to lower risk of some cancers, study finds CNN",2024-07-05,GLP-1,Science
news_313,CNBC,How digital health companies are capitalizing on the GLP-1 boom - CNBC. How digital health companies are capitalizing on the GLP-1 boom CNBC,2024-05-25,GLP-1,Health
news_314,Harvard Magazine,Can New Drugs Help Millions of Americans with Obesity? - Harvard Magazine. Can New Drugs Help Millions of Americans with Obesity? Harvard Magazine,2024-09-30,GLP-1,Health
news_315,Teneo,The Multi-Sector Impacts of GLP-1RA Drugs - Teneo. The Multi-Sector Impacts of GLP-1RA Drugs Teneo,2024-03-07,GLP-1,Health
news_316,KFF,Medicare Spending on Ozempic and Other GLP-1s Is Skyrocketing - KFF. Medicare Spending on Ozempic and Other GLP-1s Is Skyrocketing KFF,2024-03-22,Ozempic,Health
news_317,Healthline,About 13% of U.S. Adults Have Tried a GLP-1 Drug Like Ozempic - Healthline. About 13% of U.S. Adults Have Tried a GLP-1 Drug Like Ozempic Healthline,2024-05-13,Ozempic,Health
news_318,Mercer,Weight management in the era of GLP-1s - Mercer. Weight management in the era of GLP-1s Mercer,2024-03-28,GLP-1,Health
news_319,Australian Broadcasting Corporation,Ilisa was vomiting blood after injecting replica Ozempic. The pharmacy kept ringing to sell her more - Australian Broadcasting Corporation. Ilisa was vomiting blood after injecting replica Ozempic. The pharmacy kept ringing to sell her more Australian Broadcasting Corporation,2024-05-13,Ozempic,Health
news_320,MDLinx,5 unexpected side effects of Ozempic use - MDLinx. 5 unexpected side effects of Ozempic use MDLinx,2024-11-20,Ozempic,Health
news_321,NPR,Ozempic's biggest side effect: Turning Denmark into a 'pharmastate'? : Planet Money - NPR. Ozempic's biggest side effect: Turning Denmark into a 'pharmastate'? : Planet Money NPR,2024-07-30,Ozempic,Health
news_322,Time Magazine,Patients Are Suing Over Alleged Side Effects of Weight-Loss Drugs - Time Magazine. Patients Are Suing Over Alleged Side Effects of Weight-Loss Drugs Time Magazine,2024-11-04,GLP-1,Health
news_323,People.com,Ozempic Face — and Now Ozempic Breast and Butt? What's Really Going on with These Side Effects? - People.com. Ozempic Face — and Now Ozempic Breast and Butt? What's Really Going on with These Side Effects? People.com,2024-05-08,Ozempic,Health
